<?xml version="1.0" encoding="UTF-8"?>
<dataroot xmlns:od="urn:schemas-microsoft-com:officedata" xmlns:xsi="http://www.w3.org/2001/XMLSchema-instance"  xsi:noNamespaceSchemaLocation="71_ScaleSystemMapping.xsd" generated="2025-07-15T15:44:45">
<_x0037_1_ScaleSystemMapping>
<ScaleSystemMapID>1</ScaleSystemMapID>
<ScaleID>3</ScaleID>
<SystemID>1</SystemID>
<Code>SCTID: 21897009</Code>
</_x0037_1_ScaleSystemMapping>
<_x0037_1_ScaleSystemMapping>
<ScaleSystemMapID>2</ScaleSystemMapID>
<ScaleID>4</ScaleID>
<SystemID>1</SystemID>
<Code>SCTID: 370143000</Code>
</_x0037_1_ScaleSystemMapping>
<_x0037_1_ScaleSystemMapping>
<ScaleSystemMapID>3</ScaleSystemMapID>
<ScaleID>2</ScaleID>
<SystemID>1</SystemID>
<Code>SCTID: 371631005</Code>
</_x0037_1_ScaleSystemMapping>
<_x0037_1_ScaleSystemMapping>
<ScaleSystemMapID>4</ScaleSystemMapID>
<ScaleID>1</ScaleID>
<SystemID>1</SystemID>
<Code>SCTID: 25501002</Code>
</_x0037_1_ScaleSystemMapping>
<_x0037_1_ScaleSystemMapping>
<ScaleSystemMapID>5</ScaleSystemMapID>
<ScaleID>5</ScaleID>
<SystemID>1</SystemID>
<Code>SCTID: 126943008</Code>
</_x0037_1_ScaleSystemMapping>
<_x0037_1_ScaleSystemMapping>
<ScaleSystemMapID>6</ScaleSystemMapID>
<ScaleID>18</ScaleID>
<SystemID>1</SystemID>
<Code>SCTID: 370143000</Code>
</_x0037_1_ScaleSystemMapping>
<_x0037_1_ScaleSystemMapping>
<ScaleSystemMapID>7</ScaleSystemMapID>
<ScaleID>6</ScaleID>
<SystemID>1</SystemID>
<Code>SCTID: 191736004</Code>
</_x0037_1_ScaleSystemMapping>
</dataroot>
